page_id,doc_key,grade,date_guess,issue_type,severity,detail,snippet,title
762,wilson:111240,相关文献,1949-12-16,translation_failed,4,译文是模型应答/拒绝消息，未真正翻译,抱歉，您似乎没有提供需要翻译的英文原文内容。请提供,Record of conversation between Stalin and Mao Zedong
763,wilson:111240,相关文献,1949-12-16,translation_failed,4,译文是模型应答/拒绝消息，未真正翻译,抱歉，您似乎只提供了“--- page break ---”这一行，没有提供需要翻译的英文档案正文。请提供完整的英文档案内容，我将严格按照您的要求进行学术级中文翻译。,Record of conversation between Stalin and Mao Zedong
848,hathi-ia:NPCM19480203,核心文献,1948-02-03,length_long,1,译文可能偏长，中文/英文字符比 2.22,（前略，因OCR噪声及无关内容已忽略） ……“缺席”并非通常意义上的禁令，例如，英国工党的禁令就与任何共产主义组织无关。 除南京政府军队内部外，中国被取缔的政党——中国民主同盟的地下工作者，正在全国范围内动员教授、学生、商界人士及普通民众的支持，以推翻现有政权。 关于中国共产党，沈先生（沈钧儒）表示，他个人不相信共产党会反对联合政府，因为他们一贯主张联合政…,China Mail 1948-02-03 · 民盟香港复盘后
668,wilson:112226,相关文献,1949-01-10,english_residue,1,译文仍保留英文词：Kutuz,在国民党命令你们驻扎的地方，并允许我军在进攻期间通过。 [国民党将领]汤恩伯正在寻求与我们建立联系。 [国民党将领]郑介民也想与我们建立联系。 我们在西康省的电台长时间没有发报，但现在第24军军长刘文辉每天都来找我们的人，询问是否有中共的指示。 [我们]与长江上的许多江轮有联系。在进攻期间，它们将站到我们这边（关于傅作义，详见下文）： 许多知名情报人员，特…,"Cable, Terebin to Stalin [via Kuznetsov]"
765,wilson:roshchin-zhou-1949-11-10,相关文献,1949-11-10,english_residue,1,译文仍保留英文词：David、Wolff,"**1949 年 文件/讲话** **标题：与总理兼外交部长周恩来会谈备忘录** **作者：** N. V. 罗申 **日期：** 1949 年 11 月 10 日 **来源：** AVPRF, f. 0100, op. 42, por. 19, pap. 288, ll. 81-85；由 David Wolff 译自俄文。出自 David Wolff 著…",Roshchin Memorandum of Conversation with Prime Minister and Foreign Minister Zhou Enlai
